Round,Seat,Turn,Dora,Hand,Answer,ExplanationEng,ExplanationFr,Ukeire,Source
E1,W,8,1p,46m56p4566777s77z0p,6s,"You have yahkuhai and sanshoku possibilities. With 0p and aka acceptance, it's not smart to go back to 2-shanten at the 8th turn by dropping chunn. You can alo use it to open the hand for a quick win.",,iishanten:[6sx16 5px12 6px8],301-Q-161
E1,W,8,1p,06m3456677p6677z7m,6p,"Getting both yakuhai is going to be hard. Proceed with the aim of getting a pinzu sanmenchan. Considering the increased tsumo chance and the aka, the EV is good. In a standard situation, I'll cut 6p first because it's more dangerous later.",,iishanten:[6px17 7px17 6zx17 7zx17 3px13 4px11],301-Q-162
E1,S,8,2m,2340m055p2379s77z6p,6p,"It's not always possible to pon chun after the 8th turn, but if you can complete the kanchan you'll have a good wait tenpai, so I want to keep it as far as possible. Waiting for 4p7p ryanmen is too slow.",,iishanten:[2mx12 0mx12 6px12] 2-shanten:[9sx69],301-Q-163
E1,S,5,2p,057m224678p35s77z7p,4p,"It's not worth to keep both 4p and 7p, since on a 3p draw you'd have to drop dora. It's better to cut 4p and fix dora 2p as head. You have both yakuhai and chiitoi possibilities open.",,2-shanten:[7mx29 4px29 7px18 3sx15] 3-shanten:[7zx67],301-Q-164
E1,S,4,3s,567899m799p56s22z6p,9p,"Taken from a pro mahjong newspaper. The answer there was to cut 9m, but it is better to cut 9p and go back to 5 blocks. You can see the 567 sanshoku, but if nan isn't dropped, let's see what happens if we draw pinzu or souzu first. If you had cut 9m, you would still have the 6 blocks problem to resolve, but if you instead cut 9p, you can proceed to a wide iishanten.",,2-shanten:[9mx27 9px27 2zx27 6px25 8mx22],301-Q-165
E1,W,5,4m,465m224p23488s44z3s,4z,"According to a certain college girl's book ""cut 4p to keep chiitoi open"", however no matter what tile you'll draw, this is not a chiitoi hand. It'd be better to cut 3s instead of the half-way 4p, and if you don't want to cut 3s, you should cut pei. Cutting pei here brings you back to 2-shanten, but it's worth it considering the value of the hand.",,iishanten:[3sx10 2px8 4px6] 2-shanten:[4zx42],301-Q-166
E1,W,8,4m,456m334p23488s44z3s,3p,"If it were earlier in the game, I'd cut pei. But since it's the 8th turn, it's better to take iishanten. Fix the pinzu, as if the souzu shape grows, you'll get mentanpin. If you happen to draw 2p-5p before that, call riichi on shanpon. Honor shanpon is strong, so you're supposed to call instant riichi on it.",,iishanten:[3sx14 3px12 4px6] 2-shanten:[4zx42],301-Q-167
E1,W,4,4m,45m3578p23466s44z3p,4z,"6 blocks. 3 pairs aren't needed. Since the pei pair can't improve to a ryanmen like the others, cut it.",,2-shanten:[3px24 6sx24 4zx24 5px22 8px22],301-Q-168
E1,S,7,7z,34578m56p123s3s 77'7z,2s,"Because it's a ryanmen-ryanmen iishanten, fix the head. Remember ""chii has double speed"", ""chii to leave good shapes in hand""",,iishanten:[3sx28 1sx16 2sx16],301-Q-169
E1,S,7,7z,56778m06p123s3s 77'7z,3s,"Fix the sequence because you have a connected shape in manzu. If you chii 4m-7m, you have ryanmen, if you chii 4p-7p you have aryanmen or nobetan. Calling chii on 6m-9m gives you a bad tanki wait so let them pass.",,iishanten:[3sx33 7mx16 8mx16 1sx15 2sx15],301-Q-170
E1,S,7,7z,5678m557p123s3s 77'7z,7p,"Keeping 5m (8m) >> keeping 3s >> keeping 7p. If you drop 7p, you can chii 4m7m to get 6m9m wait, chii 69m to get 4m7m wait, chii 2s to get a 1s4s wait, pon 5p to get a 5m8m wait. This is typical exemple of choosing what to cut by thinking of the shape after future calls.",,iishanten:[7px42 3sx41 5mx33 8mx33 5px12],301-Q-171
E1,S,7,7z,1358p456778s4p 77'7z,8p,"After you chii 3s, 1p tanki is better than 8p tanki. You can also chii 2p to get a 3p6p ryanmen wait!",,iishanten:|1px34 8px33 8sx27 7sx17],301-Q-172
E1,S,7,2z,79m7p1224566s8m 22'2z,1s,"If you cut 1s, you will still be able to use 3s. Keep an eye for 2s pon and 3s-5s chii. You can both chii and pon the 6s, but it is better to pon, when considering the final wait (5 tiles vs. 3 tiles)",,iishanten:[1sx41 6sx28 7px25],301-Q-173
E1,S,7,5s,22389p11345s3p 11'1z,8p,"Call 1p4p chii, to get another ryanmen wait. You can also call pon and end in a decent shanpon. Dropping 2p or 3p gives the best acceptance, but you must consider calling efficiency. Dropping 9p and drawing 7p would give you furiten, unlikely to win, so start dropping the penchan from the inside.",,iishanten:[2px16 3px16 8px14 9px14 1sx8],301-Q-174
E1,E,7,4m,456m2333456p2306s,2s,"At first glance it looks like 2p is the widest tile to cut, but it's actually the 4th because of the 4 sided wait in pinzu. The best EV is given by taking advantage of that shape, so it's between 2s and 3s. Cutting 2s first allows for the 7700 points tenpai on 6s draw, so start from here!",,iishanten:[2x28 6sx28 3sx25 0sx25 2px24],301-Q-175
E1,E,4,4z,2446m23457p23467s,6m,"Keep 234 shanshoku alive. 6p tsumo in mentanpin, so its value is good enough. Ideally, you'd draw 5p or 7p for sanshoku tanyao.",,iishanten:[2mx12 6mx12],301-Q-176
E1,E,4,4z,2446m24567p23467s,2m,"To get 234 sanshoku, you'd have to drop a good shape block, so forget it. Foresee aka and ryanmen improvements. If you can, get the 567 sanshoku.",,iishanten:[2mx12 6mx12],301-Q-177
E1,W,3,1m,79m2345778p6678s8m,2p,Aim for the 78ç sanshoku and iipeikou. Let's cut 2p before 5p so that the 6p9p wait isn't obvious to the others.,,iishanten:[8px42 2px33 5px33 6sx29 7px23],301-Q-178
E1,E,5,7p,5778m22256p22467s,5m,"To get the 567 sanshoku, you need 3 specific tiles, 6m 7p 5s, so it's hard. If you cut 8m you're ensure tanyao, but I'd rather cut 5m and have the possibility to get pinfu by also dropping 2p later. The only tile that you should never drop here is 7m, as it'd be simply half-assed.",,2-shanten:[5mx32 8mx28 4sx28 7mx24 7sx24],301-Q-179
E1,E,9,7p,5778m23357p3456s6p,2p,"Cutting 5m gives you a flexible hand, but it's too late to go back into 2-shanten. If you draw 6m it's pinfu, and if you can grow the souzu shape before it, you'll get a perfect iishanten.",,iishanten:[2xpx8 3sx8 6sx8] 2-shanten:[5mx65],301-Q-180
E1,W,5,1s,78m246789p055789s,2p,"Aim for 789 sanshoku. It may look better to drop 5s and fix the ryankan, but 2p is wider in general and also wider as well for sanshoku. If you draw 9p you lose pinfu sanshoku, bout you get a ryanmen tenpai with aka, which is good enough. Another point against cutting 5s is that, if you were to complete the manzu first, you'd end up with a kanchan, while cutting 2p yields a nobetan in this situation.",,iishanten:[2px27 6px24 9px24 7mx20 5sx16],301-Q-181
E1,W,3,2s,12346m246789p24s8p,1m,"Aim for sanshoku and tanyao. If you draw 5m you get furiten, but on a wide iishanten.",,2-shanten:[8px43 6mx41 2px41 2sx41 9px39 1mx38],301-Q-182
E1,W,4,8m,78m556779p355778s,3s,"Following the peak iishanten theory, you have good odds of getting into a perfect iishanten with also sanshoku. Imagine completing the pinzu sequences, it's easy to see that you won't need 3s anyway.",,2-shanten:[9px39 3sx39 8sx35 5px28 7sx23],301-Q-183
E1,W,7,4z,3057m3355p345678s,5m,"If you draw 4p you don't want to miss iipeikou. The most flexibility is given by 3p-5p cuts, but the manzu shape is bad, so work on that. It's advantageous to keep 3 heads, even for just ponten if needed.",,iishanten:[3mx14 7mx14 5mx12 3px8 5px8],301-Q-184
E1,W,7,4z,3057m3355p34567s7p,5m,"Let's solve this by applying the 3-tiles weak block theory. Let's focus on having an impair number of tiles in each weak block, so cut the manzu shape. Let's reach iishanten with 2 head, so keep 3 heads for now. 3m takes into consideration not only the shape after drawing a triplet, but also after drawing 4p.",,2-shanten:[3mx29 7mx29 7px29 5mx27 3px27 5px27],301-Q-185
E1,E,7,1m,340m3577p223456s3p,2s,"Pinzu shape is great (tenpain on 3467 draw). You could see a 345 sanshoku, but since you have aka you don't need it. Forcing sanshoku by dropping 3p or 6s will probably give you a bad tenpai as well.",,iishanten:[2x23 3px19 7px19 5px17 3sx14 6sx14],301-Q-186
E1,W,6,1s,344m35567p344067s,4s,"The maximum acceptance is given by 3m, bit it leaves a bad shape in pinzu, so I'll fix the sanmenchan in souzu. Drawing either 5p or 8p gives you a perfect iishanten.",,iishanten:[3mx19 3sx16 4sx15 4mx12 7sx11],301-Q-187
E1,W,6,1s,355m35567p344067s,3m,The best acceptance is given by keeping 2 heads and cutting 3m. Move forward while looking for ryanmen and 567 sanshoku improvement. Don't fix sanmenchan in a rush and lose flexibility on the head.,,iishanten:[3mx19 4sx15 3sx12 7sx11 5mx8],301-Q-188
E1,W,6,1s,357m35567p344567s,3m,"The maximum acceptance is the 3s cut, but you leave bad shapes behind. Cutting 4s makes you lose sanshoku on 6m and 4p draws. 3m is a balanced cut that can get you sanshoku and still keeps iishanten. It also creates a good shape when you draw a pair on manzu or pinzu, or complete the sanmenchan.",,iishanten:[3sx12 3mx8] 2-shanten:[3px76 4sx53],301-Q-189
E1,W,7,4z,34567m0577p3466s3p,7p,"Cutting 5p may look good, but you have 6 blocks so it's bad when going into iishanten. If for instance you would draw 6s afterward, you couldn't use 0p as head, so plan for that and cut 7p instead. At 2-shanten, it's better to combine head canditates and blocks that create yaku.",,2-shanten:[5px31 7px31 3px29 3sx29 6sx27],301-Q-190
E1,W,7,3s,23556688m12p123s7m,2p,"This hand is taken from ""mukou buchi (Etsuya Tenshishi, Takeshobo). You can see a sanshoku and a double acceptance on 4m. Since the acceptance is not much different, it's better to pick the tile that gives the best tenpai. ""Sanshoku on penchan sucks"". ""Drawing 1m is better than sanshoku"". Considering these 2 ideas, cutting the penchan is the best move.",,iishanten:[5mx12 6mx12 8mx12 3mx11 1px11 2px11],301-Q-191
E1,W,7,4z,5678m445678p307s7p,8m,Aim for sanshoku. Cut from the manzu because youa lready have 5 blocks.,,iishanten:[5mx15 8mx15 3sx11 7sx11],301-Q-192
E1,W,7,3m,3334578m779p799s6m,9p,"You have dora 3. Give up sanshoku, and aim for the best possible tenpai shape. If you force sanshoku, you'd drop 7p or 9s, but it will usually be instant riichi without waiting for it anyway. Because of the wide manzu wait, the tenpai shape will probably be a kanchan in souzu. If you cut 9p, you have a 50/50 chance of getting a 4 sided wait. Let's foresee anso 5s-6s draws to move to tanyao.",,iishanten:[7px18 9sx18 9px16 7sx16],301-Q-193
E1,W,7,3p,3334578m779p799s9m,7p,"Aim for the 789 sanshoku. The 2 choices are 7p and 9s, but if you drop 7p early it will be easier to win on 8p kanchan later on. Camouflage is often ignored in madern mahjong, but if there are 2 equal choices like in this case, you can use it to decide.",,iishanten:[7px15 9sx15 9px13 7sx13],301-Q-194
E1,W,7,1p,356789m577p3346s4p,6s,"Be careful not to cut 3m, a foolish move. Let's move while looking at tanya and sanshoku. Regarding sanshoku, the 345 one is better than the 456. Be cutting 6s, you can move towards it and tanyao naturally. Starting with 9m drop would be too much.",,2-shanten:[3mx27 6sx27 6mx24 9mx24 3sx23],301-Q-195
E1,E,8,2p,79m899p23466789s0s,8p,"You should first decide if you want sanshoku or ittsu. Rather than the bad wait sanshoku, it's better to go for the 3 sided wait ittsu, if you happen to draw the 8m kanchan first. The maximum acceptance is 8p, and cutting 9p to go for sanshoku loses too many tiles to wait on.",,iishanten:[8px18 6sx14 9sx14 2sx12 9px8],301-Q-196
E1,E,4,4z,8m1306778p22678s4p,1p,"It is again a ittsu vs sanshoku problem. But drawing 9p gives you a sanmenchan with pinfu aka. If you think about it, the only way to get ittsu is drawing 2p first. Here, maximize the EV by going for sanshoku and tanyao. Even if 8m is at the edge, there's a great difference in acceptance of 9 tiles compared to1p.",,iishanten:[1px38 7px34 8mx27 4px11 8px8],301-Q-197
E1,E,7,4z,3467m1245679p22s0m,1p,"This shape is commonly called ""separated ryankan"", waiting on 3p-8p. Cut 1p to keep this shape.",,iishanten:[1px19 2px15 4px15 7px15 9px15],301-Q-198
E1,E,7,2m,66m123440679p334s,3s,"3s and 4p give the same tile acceptance. Cutting 4p makes sure of ittsu, but since we have 0p and thus 3900 points minimum, I'll give priority to good shape and pinfu.",,iishanten:[1px16 4px16 3sx16 9px14 4sx10],301-Q-199
E1,E,7,2m,66m123440679p446s,4p,"Completing either manzu of souzu gives you ittsu tenpai. You can also see 456 sanshoku and tanyao, but give priority to the almost completed ittsu.",,iishanten:[1px12 4px12 4sx12 9px10 6sx10],301-Q-200
E1,E,7,2m,68m12306899p1134s,8m,"You have 6 blocks. Aim for ittsu iishanten, and cut the manzu kanchan. Drop it starting from 8m, since it's on the outside, but if you had a sure ittsu it'd be better to start with 6m.",,2-shanten:[8px24 6mx20 8mx20 9px20 1sx20],301-Q-201
E1,E,1,9p,4m234567889p5789s,8p,"From the logs of a certain digital player. He fixed the pair and cut dora 9p, but thinking only of win speed is a wrong way to play. If you think of expected value, there's no way that losing ittsu and dora is the better choice. If you look for ittsu, it's a good idea to make the head somewhere else than pinzu. Even if you end up making the head in pinzu, you still want to have at least a dora in hand. The maximum expected value is the 8p cut.",,iishanten:[5sx40 4mx39 9px39 8px16],301-Q-202
E1,W,8,5p,307p2334567899s3p,9s,"A balance between ittsu and tanyao. Drawing 1s gives you ittsu by dropping 3s, while drawing 4s gives you tanyao by dropping 9s. If you instead cut 3s, you won't be able to get tanyao on 4s draw.",,iishanten:[3sx18 9sx18 3px15 7px15],301-Q-203
E1,W,8,5p,307p2334567899s6s,3s,"The tile acceptance is maximum. On 6s draw, cutting its suji 3s upgrades your ryanmen 1-4s wait to sanmenchan 147s.",,iishanten:[3px18 7px18 3sx18 6sx15 9sx15],301-Q-204
E1,W,7,7s,1234578m1155p67s5m,1p,"6 blocks, so one too many. Aim for a wide ittsu iishanten. If you get a triplet of 5p, you can get the hand below and transition into tanyao, so don't cut it. #12345578m055p67s#",,2-shanten:[5mx23 1px23 5px23 1mx22 4mx22],301-Q-205
E1,W,7,2m,78m2345689p2305s7p,2s,"Because there's ittsu chance, one sequence between 78m and 23s must go. If you drop 2s, you can still accept the backfire 4s for a 42 tiles iishanten, shown below. #78m23456789p340s#",,iishanten:[7mx18 8mx18 2sx18 3sx18 2px16 9px16],301-Q-206
E1,W,9,3s,446p12345679s22z7p,2z,"Leave ittsu alive. The choice is between 4p and nan. Since it's already the 9th turn, other players may be or get tenpai soon. Since you don't want to drop the second 4p later, drop nan pair. ""Safety now rather than safety later"". Also, 4p makes 1p and 7p safer for the other players due to suji, so keep it to make it harder to guess your wait.",,iishanten:[4px12 7px12 1sx12 7sx12 9sx12 2zx12],301-Q-207
E1,E,7,4z,11357m230679p79s4m,9p,"Dropping 79s penchan brings you back to 2-shanten, so the choice is between 9p and 7m. The conditions to get ittsu is to draw 8p first (as if you were to 1-4p first you'd insta riichi), and even then, you'll still need 4p. If so, it is better to leave the possibility of getting a 3-sided manzu wait on 6m draw.",,iishanten:[7mx12 9px12] 2-shanten:[9sx61],301-Q-208
E1,E,7,4z,11357m2306799p79s,9s,"Following the 2-heads theory, keep 2 pairs. With that, if you draw a triplet you can use the other as head. Foresee 567 sanshoku or ittsu improvements.",,iishanten:[1mx24 7mx24 7sx24 9sx24 3mx20 9px20],301-Q-209
E1,E,7,5m,0m22345789p2446s1p,2s,"Go into a shape that can incorporate aka 5m. If you count 1 block in mazu, and 3 blocks in pinzu, that means you have space only for 1 block in souzu. You shouldn't rush ahead and drop 2p because you want to move towards the following shapes : #06m122345789p44s# #0m122345789p406s#",,iishanten:[5mx8 1px8] 2-shanten:[2sx65],301-Q-210
E1,E,5,3s,1223p3346699s77z3p,4sr,"Chiitoi dora tenpai. it's obvious to take the 1p wait, but the question is if you should riichi. 9600 points are great, but the modern mahjong theory says to insta riichi to stop the other players and go for haneman tsumo. If the others are slowed down, your tsumo chance will naturally increase. Remember that ""if it's a bad wait don't dama, but riichi to stop the other players"" tactic.",,#1p4s,301-Q-211
E1,E,5,3s,2334p3346799s77z0p,9s,"6 blocks, so one too many. Most of them are good shapes, so cut the weakest 9s block. Even if you have a chance of chiitoi, fixing the dora head by cutting 4s is too greedy.",,#6s2p0p4s7s9s,301-Q-212
E1,E,5,3s,2334p3346899s77z4p,6s,"Chiitoi iishanten. You do have 6 blocks, but it's better to wait and see what happens with the next draws. If you can draw 2p or 4s next, the 6s early drop will make it easier to win with riichi.",,#2p4s6s8s,301-Q-213
